id,annotator,position,question,table_file,answer_coordinates,answer_text
"71141-0003,2,0,Wie viele Mill. EUR betrug das Finanzierungssaldo im Jahr 1992 bei der Körperschaftsgruppe Sozialversicherung?,tables/71141-0003.csv,""[(0,7)]"",-3008"
"73111-0002,2,0,Wie hoch sind die positiven Einkünfte in Millionen Euro im Jahr 1989?,tables/73111-0002.csv,""[(2,3)]"",24992"
"13111-0006,2,0,""Wie viele sozialversicherungspflichtige Beschäftigte am Arbeitsort gab es zum Stichtag 30.06.2020 in Baden-Württemberg im Handel, Verkehr, Lagerei und im Gastgewerbe?"",tables/13111-0006.csv,""[(2,3)]"",949464"
"22111-0012,3,0,Wie hoch sind die Nettoausgaben in Tausend Euro im Jahr 2021 für die Hilfe zur Pflege im früheren Bundesgebiet?,tables/22111-0012.csv,""[(2,0)]"",3896390"
"21111-0002,4,0,In welchem Schuljahr gab es insgesamt 10383 männliche Schüler in Schulkindergärten?,tables/21111-0002.csv,""[(3,2)]"",2020/21"
"21111-0007,5,0,Wie viele Schüler wurden im Schuljahr 2000/01 in Grundschulen mit Schwerpunkt Hören gefördert?,tables/21111-0007.csv,""[(2,1)]"",1510"
"85131-0001,2,0,""Wie hoch war im Jahr 1995 der Energieverbrauch im Produktionsbereich Textilien, Bekleidung, Leder und Lederwaren?"",tables/85131-0001.csv,""[(7,0)]"",70343"
"71211-0003,3,0,Wie hoch waren die Steuereinnahmen der Umsatzsteuer im 1. Quartal 2021?,tables/71211-0003.csv,""[(7,3)]"",45403141"
"47414-0002,4,0,Wie hoch war der Beschäftigtenindex im März 2022 bei ausgewählten Dienstleistungsbereichen und Gastgewerbe?,tables/47414-0002.csv,""[(2,4)]"",""104,5"""
"13111-0004,2,0,Wie viele männliche sozialversicherungspflichtige Beschäftigte am Arbeitsort gab es zum Stichtag 30.06.2020 im Bereich Bergbau und Gewinnung von Steinen und Erden?,tables/13111-0004.csv,""[(6,4)]"",54158"
"33111-0002,2,0,Wie viel Bodenfläche in qkm wurde zum Stichtag 31.12.2021 in Baden-Württemberg für Industrie- und Gewerbefläche genutzt?,tables/33111-0002.csv,""[(2,0)]"",""748,31"""
"46131-0002,5,0,Wie viele Tonnen Güter wurden im Januar 2021 befördert?,tables/46131-0002.csv,""[(0,2)]"",27647683"
"33111-0006,3,0,Wie viel Siedlungs- und Verkehrsfläche in qkm wurde zum Stichtag 31.12.2015 in Baden-Württemberg für Gebäude- und Freifläche genutzt?,tables/33111-0006.csv,""[(0,0)]"",""2787,770"""
"41122-0007,3,0,""In welchem Bundesland betrug im Jahr 2007 bei der Rechtsform Einzelunternehmen die betriebliche Arbeitsleistung 4,9?"",tables/41122-0007.csv,""[(7,4)]"",Baden-Württemberg"
"41122-0005,3,0,""In welchem Bundesland betrug im Jahr 2007 die landwirtschaftlich genutzt Fläche in 1000 ha 58,4?"",tables/41122-0005.csv,""[(2,4)]"",Baden-Württemberg"
"21111-0010,2,0,Wie viele Schulanfängerinnen gab es im Schuljahr 1999/00 in Baden-Württemberg?,tables/21111-0010.csv,""[(1,0)]"",59634"
"74211-0006,2,0,""Wie hoch waren die durchschnittlichen Ruhegehaltssätze der Empfänger von Ruhegehalt zum Stichtag 01.01.2021 bei Berufssoldaten der Besoldungsgruppe A14 - B11, R, W, C?"",tables/74211-0006.csv,""[(2,3)]"",""69,6"""
"21111-0007,6,0,Wie viele Schüler der Grundschule erhielten im Schuljahr 2000/01 sonderpädagogische Förderung bezüglich geistiger Entwicklung?,tables/21111-0007.csv,""[(5,1)]"",1111"
"62111-0003,4,0,Wie viel Prozent betrug zum 04/2018 der Anteil abhängiger Beschäftigungsverhältnisse mit Niedriglohn bei den unter 25 Jährigen im Bereich sonstiger wirtschaftlicher Dienstleistungen?,tables/62111-0003.csv,""[(8,3)]"",""58,0"""
"32111-0011,3,0,""In welchem Bundesland betrug der Output von Abfallentsorgungsanlagen 1000 t 1555,2 und der Input 2580,0?"",tables/32111-0011.csv,""[(8,10)]"",Bayern"
"47415-0001,3,0,Wie viele Unternehmen gab es 2020 im Grundstücks- und Wohnungswesen mit einer Umsatzgrößenklasse von 1 Mill. EUR und mehr?,tables/47415-0001.csv,""[(8,3)]"",1070"
"52111-0014,2,0,""Wie viele Unternehmen der Demografie Produzierendes Gewerbe ohne Baugewerbe, die vor einem Jahr gegründet wurden, haben 2020 überlebt?"",tables/52111-0014.csv,""[(8,5)]"",6891"
"63111-0010,1,0,""Bei welchem Gebrauchsgut betrug zum Stichtag 01.01.2011 der Ausstattungsgrad je 100 Haushalte 47,9%?"",tables/63111-0010.csv,""[(2,0)]"",Personenkraftwagen gebraucht gekauft"
"52111-0012,2,0,Wie viele abhängig Beschäftigte gab es 2020 bei Kapitalgesellschaften im produzierenden Gewerbe ohne Baugewerbe?,tables/52111-0012.csv,""[(8,4)]"",5859998"
"85111-0002,2,0,Wie viel Wasser wurde 1991 für Erzeugnisse der Land- und Forstwirtschaft und Fischerei aus der Natur entnommen?,tables/85111-0002.csv,""[(0,1)]"",Entnahme von Wasser aus der Natur"
"14121-0005,3,0,Wie hoch war zum 26.09.2021 der Anteil gültiger Zweitstimmen für die Christlich Demokratische Union Deutschlands bei den 60 bis unter 70 Jährigen in Baden-Württemberg?,tables/14121-0005.csv,""[(4,2)]"",""27,1"""
"43213-0001,5,0,Wie viele Investitionen in der Gasversorgung (in Mill. EUR) gab es im Jahr 2007?,tables/43213-0001.csv,""[(1,1)]"",""399,5"""
"71141-0006,1,0,Wie hoch waren 1984 die Investitionsausgaben der öffentlichen Haushalte in Mill. EUR bezüglich dem Erwerb von Beteiligungen in Baden-Württemberg?,tables/71141-0006.csv,""[(3,3)]"",163"
"73111-0010,2,0,Wie viele Lohn- und Einkommenssteuerpflichtige mit Einkünften von 10000 bis unter 20000 EUR gab es im Jahr 2018?,tables/73111-0010.csv,""[(2,1)]"",1075929"
"85131-0004,1,0,Wie viele verwertete inländische Rohstoffentnahmen gab es beim Erdöl im Jahr 2020?,tables/85131-0004.csv,""[(5,4)]"",1907"
"14111-0004,2,0,Wie viele gültige Zweitstimmen gab es zum Stichtag 26.09.2021 für die Freie Demokratische Partei in Baden-Württemberg?,tables/14111-0004.csv,""[(3,0)]"",908039"
"61111-0010,4,0,Wie hoch war 1995 der Verbraucherpreisindex in Sachsen?,tables/61111-0010.csv,""[(10,1)]"",""74,4"""
"21111-0008,0,0,Wie viele männliche Schüler von Grundschulen nahmen 2020/21 sonderpädagogische Förderung mit Schwerpunkt Sprache in Anspruch?,tables/21111-0008.csv,""[(3,1)]"",10467"
"41141-0002,2,0,Wie viele landwirtschaftliche Betriebe gab es im Jahr 2020 in der Größenklasse von 50 bis unter 100 ha??,tables/41141-0002.csv,""[(4,2)]"",44737"
"52111-0001,1,0,In welchem Jahr gab es 1101 Unternehmen mit 0 bis unter 10 abhängig Beschäftigten im Bereich Bergbau und Gewinnung von Steinen und Erden?,tables/52111-0001.csv,""[(0,1)]"",2020"
"53111-0004,3,0,Wie viele Personen waren im Jahr 2020 in Betrieben mit unter 5 tätigen Personen im zulassungspflichtigen Handwerk tätig?,tables/53111-0004.csv,""[(0,2)]"",2020"
"14121-0002,2,0,""In welcher Altersgruppe erreichte die Sozialdemokratische Partei Deutschlands zum Stichtag 26.09.2021 einen Anteil von 17,4% gültiger Zweitstimmen?"",tables/14121-0002.csv,""[(7,3)]"",25 bis unter 35 Jahre"
"52111-0003,4,0,Wie viele Niederlassungen gab es im Jahr 2021 bei Unternehmen mit 0 bis unter 10 abhängig Beschäftigten im Grundstücks- und Wohnungswesen?,tables/52111-0003.csv,""[(10,0)]"",209086"
"24241-0001,4,0,""Wie viele Verfahren wurden 2014 vor dem Amtsgericht erledigt, ohne dass eine vollständige Konfliktbeilegung erreicht wurde?"",tables/24241-0001.csv,""[(3,1)]"",83450"
"53111-0007,3,0,Wie viele Handwerksunternehmen gab es bei Einzelunternehmen im zulassungspflichtigem Handwerk mit 5 bis 9 tätigen Personen im Jahr 2020?,tables/53111-0007.csv,""[(7,8)]"",62091"
"71211-0002,4,0,Wie hoch waren Steuereinnahmen in Tsd. EUR bei der Lohn- und veranlagten Einkommenssteuer im Jahr 2012?,tables/71211-0002.csv,""[(7,2)]"",79188982"
"73111-0020,4,0,Wie viel betrugen die Einkünfte je Betrieb im Jahr 2018 bei der Land- und Forstwirtschaft?,tables/73111-0020.csv,""[(1,0)]"",5888"
"61111-0007,4,0,Was war die Gewichtung des Verbraucherpreisindex in Promille im Jahr 2015 bei Teigwaren?,tables/61111-0007.csv,""[(8,1)]"",""1,32"""
"24251-0001,2,0,""Wie viele Verfahren wurden im Jahr 2018 vor dem Verwaltungsgericht erledigt, wobei die Erledigung mit einem Urteil erfolgte?"",tables/24251-0001.csv,""[(0,1)]"",1711"
"61111-0005,1,0,""Wie hoch war der Verbraucherpreisindex beim Verwendungszweck Freizeit, Unterhaltung und Kultur im Jahr 2017?"",tables/61111-0005.csv,""[(8,1)]"",""102,1"""
"46131-0005,3,0,Wie viele tkm betrug die Beförderungsleistung im Jahr 2011 bei anderen Erzeugnissen pflanzlichen Ursprungs?,tables/46131-0005.csv,""[(6,4)]"",233928624"
"14121-0003,0,0,Wie hoch war der Anteil gültiger Zweitstimmen der männlichen 18 bis unter 25 Jährigen für die Christlich Demokratische Union Deutschlands?,tables/14121-0003.csv,""[(0,2)]"",""8,2"""
"24231-0002,3,0,Wie viele Verfahren in Bau-/Architektensachen wurden 2021 in Baden-Württemberg durch ein Anerkenntnis- oder Verzichtsurteil erledigt?,tables/24231-0002.csv,""[(3,3)]"",28"
"74111-0011,1,0,Wie viele männliche Beschäftigte im Aufgabenbereich Polizei gab es zum 30.06.2021 in Baden-Württemberg?,tables/74111-0011.csv,""[(3,0)]"",""1,1"""
"42111-0004,3,0,Wie viele Tsd. EUR betrug der Auslandsumsatz mit der Eurozone im Jahr 2022 bei der Gewinnung von Steinen und Erden und sonstigem Bergbau?,tables/42111-0004.csv,""[(7,7)]"",19057"
"42111-0009,2,0,In welchem Jahr betrug der Inlandsumsatz bei der Verarbeitung von Obst und Gemüse 4475870 Tsd. EUR?,tables/42111-0009.csv,""[(5,2)]"",2020"
"23121-0002,5,0,Wie viel Prozent betrug der Orientierungswert für Krankenhäuser im Jahr 2020?,tables/23121-0002.csv,""[(8,2)]"",""2,60"""
"53111-0011,2,0,Wie viele Personen waren 2020 im zulassungspflichtigen Handwerk in Baden-Württemberg im Gewerbezweig Ausbaugewerbetätig?,tables/53111-0011.csv,""[(10,2)]"",2020"
"44111-0001,1,0,Wie hoch war der Umsatz im Oktober 2016 in Baden-Württemberg für alle Betriebe?,tables/44111-0001.csv,""[(9,0)]"",1377377"
"45211-0014,1,0,Wie hoch war der Umsatz im Großhandel im Mai 2022 in Berlin?,tables/45211-0014.csv,""[(10,4)]"",""96,5"""
"71141-0004,3,0,Wie viel Mill. EUR betrugen beim Aufgabenbereich Verteidigung die Personalausgaben im Jahr 1992?,tables/71141-0004.csv,""[(2,3)]"",13928"
"45212-0001,4,0,Wie viele Teilzeitbeschäftigte gab es 1995 im Einzelhandel mit Fleisch und Fleischwaren?,tables/45212-0001.csv,""[(10,7)]"",""138,1"""
"53111-0004,4,0,Wie viele Handwerksunternehmen mit 50 und mehr tätigen Personen gab es 2020?,tables/53111-0004.csv,""[(10,7)]"",2040"
"52111-0010,5,0,Wie viel Prozent betrug im Jahr 2020 der Anteil der tätigen Personen in Unternehmensgründungen in der Branche Bergbau und Gewinnung von Steinen und Erden?,tables/52111-0010.csv,""[(5,4)]"",""0,2"""
"41122-0008,3,0,Wie hoch war 1995 die betriebliche Arbeitsleistung bei Einzelunternehmen in Baden-Württemberg bei männlichen Arbeitskräften?,tables/41122-0008.csv,""[(9,2)]"",""60,6"""
"23112-0002,4,0,Wie viele hauptamtliche Ärzte gab es zum Stichtag 31.12.1995?,tables/23112-0002.csv,""[(4,2)]"",9179"
"45211-0014,2,0,Wie viel Prozent betrug im Mai 2022 die Veränderung zur Vorjahresperiode in Baden-Württemberg?,tables/45211-0014.csv,""[(4,0)]"",""+2,6"""
"74211-0005,3,0,Wie hoch waren die durchschnittlichen Versorgungsbezüge beim Ruhegehalt männlicher Personen zum Stichmonat 01/2021?,tables/74211-0005.csv,""[(0,2)]"",2780"
"73111-0020,5,0,Wie viele Betriebe gab es 2021 bei der Einkunftsart Land- und Forstwirtschaft?,tables/73111-0020.csv,""[(9,5)]"",77169"
"24241-0002,4,0,Wie viele Verfahren wurden im Jahr 2019 in Baden-Württemberg vor dem Amtsgericht durch Beschluss in Verfahrenskostenhilfeverfahren erledigt?,tables/24241-0002.csv,""[(8,2)]"",438"
"43111-0002,3,0,Wie viel Tsd. EUR betrugen im November 2021 die Entgelte in der Elektrizitätsversorgung?,tables/43111-0002.csv,""[(10,0)]"",1604499.0"
"14111-0004,3,0,Wie hoch war der Anteil der gültigen Erststimmen für die Partei DIE LINKE zum 26.09.2021 in Baden-Württemberg?,tables/14111-0004.csv,""[(5,5)]"",""3,0"""
"74211-0006,3,0,""Wie viel Prozent betrugen zum Stichtag 01.01.2021 die durchschnittlichen Ruhegehaltssätze der Empfänger von Ruhegehalt in der Besoldungsgruppe A 14 - B 11, R, W, C bei Postnachfolgeunternehmen?"",tables/74211-0006.csv,""[(4,3)]"",""67,6"""
"22111-0003,0,0,Wie hoch waren 2021 die Bruttoausgaben bei Hilfen zur Gesundheit?,tables/22111-0003.csv,""[(1,2)]"",683027"
"74111-0002,3,0,Wie viele Teilzeit Beschäftigte im öffentlichen Dienst mit dem Dienstverhältnis Beamte und Richter gab es zum 30.06.2000 im Bundesbereich?,tables/74111-0002.csv,""[(1,0)]"",""12,3"""
"47414-0003,2,0,Wie viel betrug 2016 die Veränderung zum Vorjahr in der Güterbeförderung ohne Eisenbahnverkehr?,tables/47414-0003.csv,""[(10,3)]"",""+4,3"""
"24211-0002,2,0,Wie viele Ermittlungsverfahren wurden 2021 in Baden-Württemberg von der Staats- und Amtsanwaltschaft in Sachen Kapitalverbrechen im Sinne von § 74 Absatz 2 GVG erledigt?,tables/24211-0002.csv,""[(6,3)]"",530"
"62111-0003,5,0,Wie hoch war zum 04/2018 der Anteil abhängiger Beschäftigungsverhältnisse mit Niedriglohn bei den unter 25 Jährigen im Gastgewerbe?,tables/62111-0003.csv,""[(5,3)]"",""85,0"""
"33111-0003,4,0,Wie viele qkm Bodenfläche wurde zum 31.12.1992 als Verkehrsfläche genutzt?,tables/33111-0003.csv,""[(4,0)]"",""16440,840"""
"52111-0010,6,0,Wie viele Unternehmensschliessungen gab es 2020 beim produzierenden gewerbe ohne Baugewerbe?,tables/52111-0010.csv,""[(2,13)]"",19047"
"74111-0002,4,0,Wie viele Teilzeit Beschäftigte im öffentlichen Dienst gab es zum 30.06.2000 im Bundesbereich?,tables/74111-0002.csv,""[(9,0)]"",""42,5"""
"32121-0001,2,0,Wie hoch war das Aufkommen an Haushaltsabfällen bei biologisch abbaubaren Abfällen im Jahr 2020?,tables/32121-0001.csv,""[(5,1)]"",""5333,6"""
"46131-0003,1,0,Wie viele Tonnen Güter wurden 2006 insgesamt befördert?,tables/46131-0003.csv,""[(9,1)]"",346118090"
"46131-0003,2,0,Wie viele Tonnen Güter wurden durch grenzüberschreitenden Verstand im Jahr 2005 befördert?,tables/46131-0003.csv,""[(1,1)]"",48220060"
"14121-0006,2,0,Wie viel Prozent gültige Zweitstimmen erhielt die Christlich Demokratische Union Deutschlands von weiblichen Personen im Alter von 35 bis unter 45 Jahren zum 26.09.2021 in Baden-Württemberg?,tables/14121-0006.csv,""[(8,2)]"",""19,9"""
"42111-0002,4,0,Wie viele Tsd. EUR betrug die Bruttolohn- und gehaltsstumme im September 2022 im Bergbau und Verarbeitendem Gewerbe?,tables/42111-0002.csv,""[(8,3)]"",24219468"
"22111-0003,1,0,Wie viele Tsd. EUR Nettoausgaben gab es 2021 bei der Hilfe zur Pflege?,tables/22111-0003.csv,""[(2,0)]"",4736937"
"24211-0001,2,0,In welchem Sachgebiet wurden im Jahr 2018 611980 Ermittlungsverfahren von der Staats- und Amtsanwaltschaft erledigt?,tables/24211-0001.csv,""[(8,1)]"",Diebstahl und Unterschlagung"
"53111-0007,4,0,Wie viele Personen waren im Jahr 2020 in Einzelunternehmen mit zulassungspflichtigem Handwerk tätig?,tables/53111-0007.csv,""[(6,4)]"",479455"
"71211-0004,5,0,Wie viele Steuereinnahmen in Tsd. EUR gab es durch Lohn- und veranlagte Einkommenssteuer im 1. Quartal des Jahres 2021?,tables/71211-0004.csv,""[(7,3)]"",29189130"
"85211-0001,3,0,Wie viel qkm Siedlungsfläche hatte 2008 des übrige produzierende Gewerbe?,tables/85211-0001.csv,""[(3,0)]"",2393"
"71141-0005,4,0,Wie hoch waren die Investitionsausgaben der öffentlichen Haushalte des Bundes im Jahr 1984 bezüglich dem Erwerb von unbeweglichem Sachvermögen?,tables/71141-0005.csv,""[(2,2)]"",293"
"53111-0011,3,0,Wie hoch war der Umsatz beim zulassungspflichtigem Handwerk im Zweig Brunnenbauer im Jahr 2020 in Baden-Württemberg?,tables/53111-0011.csv,""[(7,0)]"",80145"
"21111-0007,7,0,Wie viele Grundschüler haben im Schuljahr 2000/01 sonderpädagogische Förderung erhalten?,tables/21111-0007.csv,""[(9,1)]"",38533"
"14121-0005,4,0,Wie viele gültigen Zweitstimmen erhielt die Sozialdemokratische Partei Deutschlands zum 26.09.2021 in Baden-Württemberg von den 18 bis unter 25 Jährigen?,tables/14121-0005.csv,""[(6,5)]"",""64,7"""
"62111-0012,5,0,Wie viele Bruttostundenverdienste in EUR gab es 2018 in Baden-Württemberg?,tables/62111-0012.csv,""[(10,0)]"",""21,01"""
"43312-0001,2,0,Wie viel MW betrug die Nettonennleistung durch Steinkohlenkoks im Januar 2022?,tables/43312-0001.csv,""[(1,4)]"",""0,000"""
"23111-0001,5,0,Wie viele Krankenhäuser gab es im Jahr 2001?,tables/23111-0001.csv,""[(10,2)]"",2240"
"74111-0011,2,0,Wie viele männliche Beschäftigte im Aufgabenbereich Polizei gab es in Baden-Württemberg zum 30.06.2021?,tables/74111-0011.csv,""[(6,0)]"",""21,5"""
"14121-0004,4,0,Wie viele gültige Zweitstimmen von Frauen erhielt die Partei DIE LINKE zum 26.09.2021 in Baden-Württemberg?,tables/14121-0004.csv,""[(9,5)]"",""95,8"""
"62111-0011,0,0,Wie hoch waren die Bruttostundenverdienste 2018 im Gastgewerbe in Baden-Württemberg?,tables/62111-0011.csv,""[(7,0)]"",""11,66"""
"63111-0003,2,0,Wie hoch war der Ausstattungsgrad von Blu-ray-Geräten bei Personen mit einem Haushaltsnettoeinkommen von unter 1250 EUR zum 01.01.2021,tables/63111-0003.csv,""[(9,0)]"",Blu-ray-Gerät"
"13111-0004,3,0,Wie viele sozialversicherungspflichtige männliche Teilzeit-Beschäftigte gab es zum 30.06.2020 im Bergbau?,tables/13111-0004.csv,""[(9,4)]"",1258"
"14111-0003,2,0,Wie viele Wahlberechtigte gab es zum 26.09.2021 in Bremen?,tables/14111-0003.csv,""[(4,4)]"",459749"
"22111-0002,3,0,Wie viel betrugen im Jahr 1996 die Bruttoausgaben?,tables/22111-0002.csv,""[(8,3)]"",25457615"
"14121-0006,3,0,Wie viele gültige Zweitstimmen erhielt die Christlich Demokratische Union Deutschlands zum 26.09.2021 in Baden-Württemberg von den männlichen Wählern im Alter von 60 bis unter 70 Jahren?,tables/14121-0006.csv,""[(4,6)]"",""135,1"""
"42111-0005,3,0,In welchem verarbeitenden Gewerbe betrug im Jahr 2021 der Auslandsumsatz 6074291 Tsd. EUR?,tables/42111-0005.csv,""[(8,9)]"",Schlachten und Fleischverarbeitung"
"74211-0004,1,0,""Wie viele Versorgungszugänge der männlichen Empfänger gab es 2020 in der Besoldungsgruppe A 14 - B 11, R, W, C?"",tables/74211-0004.csv,""[(9,0)]"",15"
"22111-0014,2,0,Wie hoch waren 2021 die Bruttoausgaben der örtlichen Träger durch Hilfe bei sozialen Schwierigkeiten und in anderen Lebenslagen?,tables/22111-0014.csv,""[(4,3)]"",178526"
"85111-0003,4,0,Wie viele Mill. cbm Abwasser wurden im Jahr 1991 durch Erzeugnisse der Land- und Forstwirtschaft indirekt eingeleitet?,tables/85111-0003.csv,""[(1,1)]"",33"
"74111-0010,2,0,Wie viele männliche Beschäftigte im Aufgabenbereich Polizei gab es im Landesbereich zum 30.06.2021?,tables/74111-0010.csv,""[(9,0)]"",""178,2"""
"21111-0008,1,0,Wie viele männliche Schüler von Grundschulen erhielten im Schuljahr 2020/21 sonderpädagogische Förderung im Bereich Hören?,tables/21111-0008.csv,""[(2,1)]"",1800"
"52111-0006,3,0,Wie viele Niederlassungen gab es 2021 in Baden-Württemberg im Grundstücks- und Wohnungswesen?,tables/52111-0006.csv,""[(10,0)]"",27164"
"32111-0003,2,0,Wie viele 1000 Tonnen Abfälle wurden 2020 zur Verwertung genutzt?,tables/32111-0003.csv,""[(7,2)]"",""1906,3"""
"61111-0011,3,0,Was war der Verbraucherpreisindex im Januar 2018 in Baden-Württemberg?,tables/61111-0011.csv,""[(0,2)]"",""102,2"""
"45211-0003,4,0,""Wie war der Umsatz im Jahr 1995 im Großhandel mit Obst, Gemüse und Kartoffeln?"",tables/45211-0003.csv,""[(6,2)]"",""84,1"""
"71141-0006,2,0,Wie hoch waren 1984 die Investitionsausgaben bezüglich dem Erwerb von beweglichem Sachvermögen in Baden-Württemberg??,tables/71141-0006.csv,""[(8,3)]"",163"
"46131-0006,2,0,Wie viele Tonnen Erdgas wurden im Januar 2022 durch Verkehr innerhalb Deutschlands befördert?,tables/46131-0006.csv,""[(5,2)]"",592"
"45211-0011,3,0,Wie war im Jahr 2018 die Veränderung zum Vorjahr in Rheinland-Pfalz?,tables/45211-0011.csv,""[(9,2)]"",""+2,8"""
"71141-0001,3,0,Wie hoch waren die Ausgaben der öffentlichen Haushalte durch Erwerb von beweglichem Sachvermögen im Jahr 1992?,tables/71141-0001.csv,""[(10,3)]"",930"
"47415-0001,4,0,Wie viele Einzelunternehmen mit einer Umsatzgrößenklasse von unter 250000 EUR gab es im Jahr 2020 im Grundstücks- und Wohnungswesen?,tables/47415-0001.csv,""[(6,3)]"",54924"
"73111-0011,2,0,Wie viele Tsd. EUR aussergewöhnliche Belastungen gab es 2018?,tables/73111-0011.csv,""[(2,1)]"",1185781"
"33111-0005,4,0,Wie viel Siedlungs- und Verkehrsfläche wurde zum 31.12.1996 als Erholungsfläche genutzt?,tables/33111-0005.csv,""[(7,0)]"",""2373,855"""
"13111-0006,3,0,Wie viele sozialversicherungspflichtige Beschäftigte im Bereich sonstiger Dienstleistungen gab es zum 30.06.2020 in Bayern?,tables/13111-0006.csv,""[(9,3)]"",2595091"
"47415-0003,3,0,Wie viele Einzelunternehmen zum Betrieb von Taxis gab es im Jahr 2020?,tables/47415-0003.csv,""[(5,2)]"",17734"
"62111-0101,4,0,Was waren zum Stichmonat 10/2005 die Bruttomonatsverdienste der weiblichen Arbeiter im früheren Bundesgebiet ohne abgeschlossener Berufsausbildung?,tables/62111-0101.csv,""[(6,6)]"",1955"
"48112-0002,2,0,Wie viele Lohn- und Gehaltsempfänger gab es im Jahr 2020 in der Gewinnung von Steinen und Erden?,tables/48112-0002.csv,""[(1,4)]"",29883"
"85131-0004,2,0,Wie viele 1000 Tonnen abiotische Rohstoffe wurden 2020 verwertet?,tables/85131-0004.csv,""[(1,4)]"",714807"
"45211-0013,5,0,Was war die Veränderung zum Vorjahr im Jahr 2018 in Hessen?,tables/45211-0013.csv,""[(5,3)]"",""+1,1"""
"47414-0004,4,0,Was war der Umsatzindex im Mai 2022 in ausgewählten Dienstleistungsbereichen und dem Gastgewerbe?,tables/47414-0004.csv,""[(4,5)]"",""115,1"""
"42111-0008,3,0,Wie viele 1000 Arbeitsstunden wurden in der Herstellung von Gummi- und Kunststoffwaren im Jahr 2005 geleistet?,tables/42111-0008.csv,""[(8,0)]"",433454"
"47414-0003,3,0,Wie hoch war der Umsatzindex im Jahr 2016 in der Personenbeförderung?,tables/47414-0003.csv,""[(5,4)]"",""99,8"""
"85411-0001,3,0,Wie viele Mill. EUR wurden im Jahr 2006 für den Umweltschutz ausgegeben?,tables/85411-0001.csv,""[(10,5)]"",34860"
"53111-0011,4,0,Wie viele Personen waren im Jahr 2020 in Baden-Württemberg im Gewerbezweig Dachdecker tätig?,tables/53111-0011.csv,""[(4,2)]"",2020"
"74111-0010,3,0,Wie viele 1000 männliche Beschäftigte im Aufgabenbereich Polizei gab es zum 30.06.2021 im Bundesbereich?,tables/74111-0010.csv,""[(3,0)]"",""4,5"""
"14111-0004,4,0,Wie viele gültige Erststimmen erhielt die Partei Bündnis C - Christen für Deutschland zum 26.09.2021 in Baden-Württemberg?,tables/14111-0004.csv,""[(7,6)]"",452"
"52111-0002,3,0,Wie viele rechtliche Einheiten gab es 2021 im Grundstücks- und Wohnungswesen bei Unternehmen mit 0 bis unter 10 abhängig Beschäftigten?,tables/52111-0002.csv,""[(10,2)]"",204487"
"47414-0004,5,0,Was war die Veränderung zur Vorjahrsperiode bei ausgewählten Dienstleistungsbereichen und dem Gastgewerbe im Juni 2022?,tables/47414-0004.csv,""[(5,0)]"",""+9,1"""
"21111-0004,4,0,Wie viele männliche BILABS Absolventen und Abgänger mit Hauptschulabschluss gab es im Schuljahr 2019/20?,tables/21111-0004.csv,""[(9,1)]"",4449"
"61111-0004,3,0,Was war der Verbraucherpreisindex im Januar 2021 bei Frühstückszubereitungen?,tables/61111-0004.csv,""[(9,3)]"",""106,8"""
"73111-0011,3,0,Wie viele Tsd. EUR aussergewöhnliche Belastungen gab es im Jahr 2018?,tables/73111-0011.csv,""[(10,1)]"",3191655"
"43311-0001,3,0,Wie viele MWh Elektrizität wurden 2021 durch Steinkohlen erzeugt?,tables/43311-0001.csv,""[(0,2)]"",46662271"
"33111-0001,2,0,Wie viel Bodenfläche wurde zum 31.12.2016 für Grünanlagen genutzt?,tables/33111-0001.csv,""[(10,0)]"",""2675,61"""
"24231-0002,4,0,In welchem Jahr wurden in Baden-Württemberg keine Verfahren in Bau-/Architektensachen durch Nichtzahlung des Kostenvorschusses erledigt?,tables/24231-0002.csv,""[(10,0)]"",2021"
"44111-0001,2,0,Wie viele Personen waren im Mai 2016 in Baden-Württemberg tätig?,tables/44111-0001.csv,""[(4,3)]"",Mai"
"24231-0002,5,0,Wie viele Verfahren wurden 2021 in Baden-Württemberg nach VO(EU)655/2014 in Bau-/Architektensachen erledigt?,tables/24231-0002.csv,""[(6,3)]"",0"
"23112-0001,0,0,Wie viele Tage betrug die durchschnittliche Verweildauer im Jahr 1996?,tables/23112-0001.csv,""[(5,5)]"",""30,2"""
"53111-0005,3,0,Wie viele geringfügig entlohnte Beschäftigte gab es 2019 im Bauhauptgewerbe?,tables/53111-0005.csv,""[(7,10)]"",730"
"52111-0014,3,0,Wie viele Personen waren 2020 im produzierenden Gewerbe und Dienstleistungsbereich in überlebenden Unternehmen mit 5 bis 9 abhängig Beschäftigten tätig?,tables/52111-0014.csv,""[(2,6)]"",66161"
"24221-0001,2,0,Wie viele Strafverfahren wurden 2017 vor dem Amtsgericht in Sachen Kapitalverbrechen im Sinne von § 74 Absatz 2 GVG erledigt?,tables/24221-0001.csv,""[(2,2)]"",47"
"45211-0011,4,0,Was war die Veränderung zum Vorjahr 2018 in Niedersachsen?,tables/45211-0011.csv,""[(7,2)]"",""+1,6"""
"31111-0005,2,0,Wie viele Wohnräume gab es im Jahr 2001 bei Fertigteilbau Wohngebäuden mit einer oder zwei Wohnungen?,tables/31111-0005.csv,""[(4,1)]"",125064"
"41141-0002,3,0,In welchem Jahr war die Fläche der Betriebsflächen 1791764 ha?,tables/41141-0002.csv,""[(7,0)]"",2020"
"41122-0004,3,0,Wie hoch war die Arbeitsleistung für männliche Arbeitskräfte für Einzelunternehmen für Größenklassen 2 bis unter 5 ha im Jahr 1995?,tables/41122-0004.csv,""[(2,2)]"",""33,5"""
"45211-0014,3,0,Was ist die Veränderung im Januar 2022 für konstante Preise in Baden-Württemberg?,tables/45211-0014.csv,""[(0,0)]"",""+4,2"""
"62111-0004,4,0,""Wie hoch ist der Bruttostundenverdienst für den Handel, die Instandshaltung und Reparatur von KFZ im Jahr 2018?"",tables/62111-0004.csv,""[(5,0)]"",""16,83"""
"45211-0001,5,0,""Wie hoch ist die Anzahl der Teilzeitbeschäftigte im Jahr 1995 im Großhandel mit Zucker, Süßwaren und Backwaren?"",tables/45211-0001.csv,""[(10,7)]"",""590,9"""
"14121-0002,3,0,Wie hoch ist der Anteil gültiger Zweitstimmen für die Sozialdemokratische Partei Deutschlands zum Stichtag 26.09.2021 in der Altergruppe 35 bis unter 45 Jahre?,tables/14121-0002.csv,""[(8,2)]"",""19,2"""
"41122-0002,3,0,Wie viele männliche Arbeitskräfte gab es für die Rechtsform Einzelunternehmen im Jahr 2007?,tables/41122-0002.csv,""[(8,3)]"",""628,6"""
