id,annotator,position,question,table_file,answer_coordinates,answer_text
"66,0,0, Wie oft finden Sitzungen des Aufsichtsrats statt?,tables/hypo23b.csv,""[(2, 2)]"",[5 x jÃ¤hrlich]"
"84,1,0,Wie hoch war der Anteil der männlicher Mitarbeitenden ohne Führungsverantwortung im Jahr 2022?,tables/volks79c.csv,""[(2, 4)]"",[36]"
"62,3,0,Wie hoch waren die THG-Emissionen durch Fernwärme (ortsbasierte Berechnung) im Jahr 2023 für die Bank?,tables/hypo65b.csv,""[(6, 2)]"",[55]"
"52,2,0,Wie hoch war der Sachaufwand im Jahr 2023 für die Bank nach UGB in Tausend Euro?,tables/hypo26.csv,""[(7, 2)]"",[-42.937]"
"48,0,0,Wie viele Personen sind älter als 30 und jünger als 50 Jahre in der Gesamtzahl?,tables/table55.csv,""[(4, 1)]"",[10]"
"66,1,0, Wie oft findet die Jahreshauptversammlung der Eigentümer statt?,tables/hypo23b.csv,""[(1, 2)]"",[jÃ¤hrlich]"
"50,1,0,Wie hoch war der Energieverbrauch in kWh für Heizöl im Jahr 2022 für die Bank?,tables/hypo66.csv,""[(2, 4)]"",[98.028]"
"17,0,0,Wie hoch ist der Gesamtwert in Vollzeitäquivalenten für Mitarbeitende unter 30 Jahren?,tables/table18.csv,""[(0, 1)]"",[1217.45]"
"10,0,0,Wie hoch waren die finanzierten Treibhausgasemissionen (t CO2e) im Scope 1 im Jahr 2022?,tables/table11.csv,""[(1, 2)]"",[240534]"
"37,0,0,Wie hoch ist die Gesamtanzahl der Vollzeitäquivalente (VZÄ) für weibliche Personen?,tables/table41.csv,""[(0, 1)]"",[14.6]"
"91,0,0,Wie hoch waren die Emissionen (in t CO2e) für Scope 2 im Sektor H - Verkehr und Lagerei?,tables/table9teil2.csv,""[(0, 3)]"",[49425]"
"92,0,0,""Wie hoch waren die gesamten Emissionen (Scope 1+2, in t CO2e) für den Sektor T?"",tables/table9teil3.csv,""[(5, 4)]"",[17235]"
"14,0,0,Wie hoch ist die Gesamtanzahl der teilzeitbeschäftigten Angestellten (in VZÄ)?,tables/table15.csv,""[(4, 5)]"",[1595.89]"
"118,0,0,Wie hoch war der gesamte Wärmeverbrauch aus nicht-erneuerbarer Energie im Jahr 2023 im Volksbanken-Verbund?,tables/volks59aTeil3.csv,""[(6, 3)]"",[12627682]"
"91,1,0,Wieviele Emissionen in Tonnen CO2e können Scope 1 zugeschrieben werden?,tables/table9teil2.csv,""[(2, 2)]"",[2012]"
"18,0,0,Wieviel Vollzeitäquivalente sind gesamt angestellt?,tables/table19.csv,""[(4, 1)]"",[701.64]"
"37,1,0,Wie viele Vollzeitäquivalente (VZÄ) gibt es für Personen über 50 Jahre?,tables/table41.csv,""[(5, 1)]"",[9.66]"
"33,0,0,Wie viele Vollzeitäquivalente (VZÄ) gibt es für männliche Mitarbeitende?,tables/table34.csv,""[(1, 1)]"",[106.97]"
"86,1,0,Welches Geschlecht arbeitet am meisten?,tables/volks81.csv,""[(8, 1)]"",[M]"
"117,0,0,Wie hoch war der Heizwärmeverbrauch aus erneuerbaren Energien für die Volksbank Tirol AG im Jahr 2023 (in kWh)?,tables/volks59aTeil2.csv,""[(1, 3)]"",[658117]"
"116,0,0,Wie hoch war der Energieverbrauch (kWh) der Volksbank Tirol AG im Jahr 2021?,tables/volks58teil2.csv,""[(0, 3)]"",[1.402.794]"
"87,0,0,Wie hoch war der NPS-Score der Volksbank Oberösterreich AG im Jahr 2022?,tables/volks82.csv,""[(5, 3)]"",[1]"
"12,0,0,Wie hoch war die Gesamtmenge des gefährlichen Abfalls in Tonnen im Immobiliensektor?,tables/table13.csv,""[(1, 3)]"",[0.51]"
"9,0,0,Wie hoch ist der PCAF Score von Scope 1 und 2 ?,tables/table10.csv,""[(3, 6)]"",[4.5]"
"19,0,0,Wie viele VZÄ waren männlich?,tables/table20.csv,""[(1, 1)]"",[800.47]"
"117,1,0,In welchem Jahr war die Heizwärme for erneuerbare Energie der Volksbank Vorarlberg bei 623403?,tables/volks59aTeil2.csv,""[(2, 4)]"",[623403]"
"90,0,0,Wie hoch sind die Spareinlagen und sonstige Einlagen im Jahr 2023 in TEUR?,tables/volks90.csv,""[(5, 3)]"",[22208314]"
"15,0,0,Wie hoch ist der Anteil der weilblichen Vollzeit-Äquivalente?,tables/table16.csv,""[(2, 1)]"",[66.22]"
"117,2,0,In welcher Einheit wird Heizwärme gemessen? ,tables/volks59aTeil2.csv,""[(4, 2)]"",[kWh]"
"115,0,0,Wie hoch war der Anteil der Gesamtemissionen im Jahr 2022?,tables/volks57j.csv,""[(3, 2)]"",[3159106]"
"114,0,0,Wie groß waren die indirekten Emissionen der Volksbank Wien AG im Jah 2022?,tables/volks57i.csv,""[(2, 2)]"",[701.518]"
"19,1,0,Wie viele Mitarbeiter gibt es insgesamt?,tables/table20.csv,""[(2, 1)]"",[1522.78]"
"34,0,0,Wie viele weibliche Mitarbeiter gibt es?,tables/table35.csv,""[(0, 1)]"",[83.97]"
"17,1,0,Wie groß ist die VZÄ der > 50 jährigen?,tables/table18.csv,""[(2, 1)]"",[1998.99]"
"114,1,0,Wie groß waren die Indirekten Emissionen der Volksbank Wien AG im Jahr 2023?,tables/volks57i.csv,""[(1, 1)]"",[188.925]"
"10,1,0,Wie hoch ist das Bruttosaldo von THG-Emissionen im Stahl-Sektor?,tables/table11.csv,""[(0, 1)]"",[1114.0]"
"115,1,0,Wie hoch waren die indirekten Emissionen (Scope 2  market based) des gesamten Volksbanken-Verbundes im Jahr 2022?,tables/volks57j.csv,""[(1, 2)]"",[1021624]"
"35,1,0,""Wie viele Angestellte gab es im Jahr insgesamt für die männlichen und weiblichen Mitarbeitenden, zusammen?"",tables/table36.csv,""[(0, 3)]"",[424.15]"
"18,1,0,Wie viele männliche Mitarbeitende gab es in Vollzeitäquivalenten (VZÄ),tables/table19.csv,""[(1, 1)]"",[972.37]"
"92,1,0,Wie hoch waren die Gesamtemissionen (Scope 1+2) im Sektor Gesundheits- und Sozialwesen?,tables/table9teil3.csv,""[(2, 4)]"",[8281]"
"90,1,0,Wie hoch war der Anteil der Firmenkunden im Ausland im Jahr 2023 in TEUR?,tables/volks90.csv,""[(3, 2)]"",[92260]"
"18,2,0,Wie viele Mitarbeiter waren im Jahr 2023 über 50 Jahre alt in Vollzeitäquivalenten,tables/table19.csv,""[(5, 1)]"",[270.03]"
"86,2,0,ungültig,tables/volks81.csv,""[(6, 1)]"",[nan]"
"18,3,0,Wie hoch ist die Gesamtanzahl bei weiblichen Personen?,tables/table19.csv,""[(0, 1)]"",[852.62]"
"37,2,0,ungültig,tables/table41.csv,""[(3, 1)]"",[9.86]"
"89,0,0,ungültig,tables/volks87.csv,""[(0, 6)]"",[nan]"
"36,0,0,Wie viele männliche Personen sind in der Hierachie Ebene 3?,tables/table37.csv,""[(1, 2)]"",[20.0]"
"117,3,0,Wie hoch war der gesamte Wärmeverbrauch aus nicht-erneuerbarer Energie im Volksbanken-Verbund im Jahr 2022 in kWh?,tables/volks59aTeil2.csv,""[(6, 4)]"",[16367056]"
"17,2,0,Wie viele Vollzeitäquivalente (VZÄ) gibt es in der Alterskategorie zwischen 30 und 50 Jahre?,tables/table18.csv,""[(1, 1)]"",[3725.78]"
"87,1,0,Wie hoch war der NPS Score der Volksbank Niederösterreich AG im Jahr 2023?,tables/volks82.csv,""[(4, 1)]"",[13]"
"9,1,0,In welchem Sektor des Climate Policy Reports wurde eine THG-Intensität von 155 erhoben?,tables/table10.csv,""[(2, 0)]"",[transportation]"
"37,3,0,Welche Alterskategorie hatte den größten Anteil an VZA?,tables/table41.csv,""[(4, 0)]"",[> 30 und < 50]"
"35,2,0,Wie hoch ist  die Gesamtanzahl von unbefristeten Angestellten?,tables/table36.csv,""[(1, 3)]"",[424.15]"
"116,1,0,Wie viele kWh wurden 2021 gesamt vom Volksbanken-Verbund verbraucht?,tables/volks58teil2.csv,""[(3, 3)]"",[12.448.661]"
"14,1,0,Wie viele Stunden VZAE wurden von unbefristeten weiblichen Angestellten gearbeitet?,tables/table15.csv,""[(1, 3)]"",[2895.38]"
"18,4,0,Wieviel Vollzeitäquivalente arbeiten bei Illwerke vkw in Bregenz,tables/table19.csv,""[(2, 1)]"",[1824.99]"
"35,3,0,Wie viele Frauen waren in Vollzeit beschäftigt?,tables/table36.csv,""[(3, 1)]"",[117.55]"
"116,2,0,Wie viele kwh Strom verbrauchten die Unternehmen im Jahr 2022?,tables/volks58teil2.csv,""[(4, 2)]"",[71]"
"10,2,0,Wie hoch war der Bruttosaldo 2022?,tables/table11.csv,""[(4, 1)]"",[179.0]"
"19,2,0,Wie hoch ist die Gesamtanzahl der Vollzeitäquivalente? ,tables/table20.csv,""[(5, 1)]"",[64.26]"
"117,4,0,Wie viel kWh per m2 wurde 2021 an Heizwaerme verbraucht?,tables/volks59aTeil2.csv,""[(7, 5)]"",[106]"
"14,2,0,Wie hoch ist die Gesamtzahl der befristeten Angestellten?,tables/table15.csv,""[(2, 5)]"",[92.48]"
"16,0,0,Wie viele Studnen VZÄ wurden von beiden Geschlechtern gesamt in Deutschland geleistet?,tables/table17.csv,""[(2, 2)]"",[344.52]"
"36,1,0,ungültig,tables/table37.csv,""[(2, 0)]"",[Restliche Mitarbeiter]"
"33,1,0,Wie hoch ist die Gesamtzahl der Vollzeitäquivalente,tables/table34.csv,""[(2, 1)]"",[220.27]"
"18,5,0,Wie viele Personen sind jünger als 30 Jahre im Vollzeitäquivalent,tables/table19.csv,""[(3, 1)]"",[853.31]"
"90,2,0,Wie hoch war der regional Anteil der Privatkunden im Jahr 2023?,tables/volks90.csv,""[(1, 4)]"",[96.4%]"
"87,2,0,Wie hoch war der NPS Score für die Volksbank Kärnten eG im Jahr 2023?,tables/volks82.csv,""[(3, 1)]"",[15]"
"94,0,0,Welche Art der Zusammenkunft haben Berater regelmäßig mit Kunden?,tables/hypo23bteil2.csv,""[(0, 1)]"",[ PersÃ¶nlicher Kontakt mit Beratern]"
"111,0,0,Wie hoch waren die indirekten Emissionen (Scope 2  location based) der Volksbank Steiermark AG im Jahr 2023?,tables/volks57f.csv,""[(2, 1)]"",[284.312]"
"39,0,0,Wie viele weibliche Vollzeitbeschäftigte gab es insgesamt?,tables/table43.csv,""[(3, 1)]"",[943.79]"
"99,0,0,""Wie hoch war der Prozentsatz der Aufsichtsräte/Verwaltungsräte im Konzern, die 50 Jahre oder älter waren, im Jahr 2022?"",tables/hypo57a(problematic)teil2.csv,""[(4, 3)]"",""[97,0 %]"""
"43,0,0,Wie viele männliche Mitarbeitende gab es insgesamt nach Vollzeitäquivalenten (VZÄ)?,tables/table47.csv,""[(1, 1)]"",[789.94]"
"108,0,0,Pitanje: Wie hoch waren die direkten Emissionen (Scope 1) der Volksbank Niederösterreich AG im Jahr 2021?,tables/volks57c.csv,""[(0, 3)]"",[432.733]"
"76,0,0,Wie viel kWh der Heizwärme wurden im Jahr 2022  von der Österreichischen Ärzte- und Apothekerbank AG durch erneuerbare Energien erzeugt?,tables/volks59a.csv,""[(0, 4)]"",[12269]"
"93,0,0,Welcher Sektor gehört zur Alignment Metrik mit finanzierten Treibhausgasemissionen von 7811 Tonnen?,tables/table11teil2.csv,""[(2, 0)]"",[Luftfahrt]"
"94,1,0,Wie häufig finden Kundenbefragungen mit Kunden statt?,tables/hypo23bteil2.csv,""[(7, 2)]"",[regelmÃ¤Ã\x9fig]"
"44,0,0,Wie viele weibliche Angestellte gibt es insgesamt auf Hierarchieebene 3 in Vollzeitäquivalenten?,tables/table51.csv,""[(1, 1)]"",[7.9]"
"94,2,0,Wie oft fand die Zusammenkunft im Bereich Beschwerdemanagement für Kunden statt?,tables/hypo23bteil2.csv,""[(4, 2)]"",[bei Bedarf]"
"105,0,0,Welche wesentlichen Themen beschäftigen vorbildliche Arbeitgeber?,tables/volks24teil2.csv,""[(1, 0)]"",[Mitarbeiterzufriedenheit]"
"95,0,0,Wie oft kommt der Vorstand zu einem Meeting zusammen?,tables/hypo23bteil3.csv,""[(1, 2)]"",[regelmÃ¤Ã\x9fig]"
"120,0,0,Wie viele Tonnen CO2-Äquivalente fielen im Jahr 2023 für den Industriezweig Commercial Real Estates an?,tables/volks61teil3.csv,""[(5, 2)]"",[388739]"
"109,0,0,In welchem Jahr sind die direkten Emissionen der Volksbank Oberösterreich AG bei 193.05?,tables/volks57d.csv,""[(0, 1)]"",[193.05]"
"41,0,0,Wie viele sind in der Region der Betriebsstätte.1 weiblich?,tables/table45.csv,""[(1, 2)]"",[59.63]"
"103,0,0,Wie hoch sind die THG-Emissionen bei Konzernen 2023?,tables/hypo65bTeil3.csv,""[(2, 1)]"",[6]"
"100,0,0,Wie hoch war der Anteil von männlichen Angestellten in Fuehrungspositionen bei Banken 2023? ,tables/hypo57a(problematic)teil3.csv,""[(1, 2)]"",""[80,0 %]"""
"108,1,0,Wie hoch ist der Anteil der indirekten Emissionen 2022?,tables/volks57c.csv,""[(2, 2)]"",[370.166]"
"40,0,0,Wie viele der restlichen Mitarbeiter sind weiblich?,tables/table44.csv,""[(2, 1)]"",[1423.07]"
"112,0,0,Wie viele indirekte Emissionen gab es im Jahr 2021?,tables/volks57g.csv,""[(2, 3)]"",[302.068]"
"94,3,0,Wie oft betreut das Kundenservicecenter seine Kunden?,tables/hypo23bteil2.csv,""[(2, 2)]"",[regelmÃ¤Ã\x9fig]"
"42,0,0,Wie hoch ist die VZÄ der < 30 Jährigen?,tables/table46.csv,""[(0, 1)]"",[584.45]"
"102,0,0,Wie viel THG-Emissionen erzeugten Banken im Jahr 2023 in Tonnen?,tables/hypo65bTeil2.csv,""[(4, 2)]"",[104]"
"97,0,0,Wie viele Mitarbeiter in Teilzeit gab es im Jahr 2022 im Konzern?,tables/hypo54teil2.csv,""[(3, 3)]"",[255]"
"39,1,0,""Wie viele männliche Angestellte gab es insgesamt, gemessen in Vollzeitäquivalenten?"",tables/table43.csv,""[(0, 2)]"",[2045.21]"
"103,1,0,Wie hoch waren die gesamten THG-Emissionen für Scope 1 bis 3 in Tonnen CO2-Äquivalent für den Konzern im Jahr 2022?,tables/hypo65bTeil3.csv,""[(5, 3)]"",[1.863]"
"104,0,0,Wie hoch war der Energieverbrauch in kWh im Jahr 2023 für den Konzern?,tables/hypo66teil2.csv,""[(2, 1)]"",[320.702]"
"43,1,0,Wie hoch war der Anteil der weiblichen Mitarbeitenden im Jahr 2023,tables/table47.csv,""[(0, 1)]"",[680.14]"
"97,1,0,Wie viele männliche Mitarbeitende waren im Jahr 2023 in der Bank beschäftigt?,tables/hypo54teil2.csv,""[(5, 2)]"",[32]"
"96,0,0,Wie hoch war die Stabilitätsabgabe im Jahr 2021 für die Bank nach UGB in Tausend Euro?,tables/hypo26teil2.csv,""[(5, 6)]"",[-2.676]"
"103,2,0, Welche THG-Emissionen wurden für Konzern im Jahr 2023 für die Anfahrt externer Dienstleister gemessen?,tables/hypo65bTeil3.csv,""[(4, 1)]"",[27]"
"43,2,0,Wie viele Personen sind in der Gesamtzahl vertreten?,tables/table47.csv,""[(2, 1)]"",[1470.08]"
"41,1,0,ungültig,tables/table45.csv,""[(0, 0)]"",[Geschlecht]"
"98,0,0,Wieviele Männer arbeiteten im Konzern im Jahr 2022?,tables/hypo54teil3.csv,""[(2, 3)]"",[388]"
"41,2,0,ungültig,tables/table45.csv,""[(3, 2)]"",[120.42]"
"98,1,0,Wie viele Mitarbeiter arbeiteten im Jahr 2022 in einer Bank (nach Köpfen),tables/hypo54teil3.csv,""[(0, 4)]"",[795]"
"44,1,0,Wie viele männliche Vollzeitäquivalente (VZÄ) gibt es auf Ebene 2?,tables/table51.csv,""[(0, 2)]"",[4.0]"
"96,1,0,Was wurde im Jahr 2023 in der Bank UGB um -4.434 weniger ausgeschüttet?,tables/hypo26teil2.csv,""[(2, 0)]"",[Dividenden*]"
"44,2,0,Wie hoch ist die Vollzeitäquivalente der Frauen insgesamt?,tables/table51.csv,""[(3, 1)]"",[72.34]"
"102,1,0,Wie hoch war der Ausstoß an THG-Emissionen des Konzerns im Jahr 2023?,tables/hypo65bTeil2.csv,""[(2, 1)]"",[86]"
"42,1,0,Welche Alterskategorie hat einen Gesamt VZÄ von 1891.6?,tables/table46.csv,""[(1, 1)]"",[1891.6]"
"95,1,0,Wie oft kommen geschaeftliche Kontakte und Liefernaten /externe Dienstleister zusammen?,tables/hypo23bteil3.csv,""[(2, 2)]"",[regelmÃ¤Ã\x9fig]"
"102,2,0,ungültig,tables/hypo65bTeil2.csv,""[(1, 0)]"",[Energiebezogene Emissionen (GHGP 3.3)]"
"103,3,0,ungültig,tables/hypo65bTeil3.csv,""[(1, 0)]"",[Material (GHGP 3.1)]"
"99,1,0,Wie Prozent im Aufsichtsrat&Verwaltungsrat sind Maenner im Jahr 2022 Bank?,tables/hypo57a(problematic)teil2.csv,""[(1, 4)]"",""[80,0 %]"""
"105,1,0,Welche beiden wichtigen Themen wurden im Bericht angesprochen?,tables/volks24teil2.csv,""[(2, 0)]"",[Vielfalt und Chancengleichheit]"
"40,1,0,Wie hoch ist der weibliche Anteil? ,tables/table44.csv,""[(3, 1)]"",[1455.85]"
"106,0,0,In Welchem Jahr war die Anzahl am höchsten? ,tables/volks57a.csv,""[(2, 2)]"",[26.087]"
"98,2,0,ungültig,tables/hypo54teil3.csv,""[(5, 0)]"",[MÃ¤nner]"
"105,2,0,ungültig,tables/volks24teil2.csv,""[(4, 3)]"",[GRI 418]"
"98,3,0,ungültig,tables/hypo54teil3.csv,""[(1, 0)]"",[Frauen]"
"105,3,0,""Welche Belange gem. NaDiVeG sind im Kapitel Energie und  Klima"""" aufeglistet?"""""",tables/volks24teil2.csv,""[(3, 2)]"",[Umweltbelange]"
"96,2,0,Wie viel Geld (in TEUR) gab der Konzern 2021 (IFRS) für Löhne und Gehälter aus?,tables/hypo26teil2.csv,""[(1, 5)]"",[-49.672]"
"101,0,0,Wie hoch war der Prozentsatz der Angestellten unter 30 Jahren im Jahr 2023 für die Bank?,tables/hypo57a(problematic)teil4.csv,""[(2, 2)]"",""[21,9 %]"""
"123,0,0,Wie hoch war der NPS-Score der Volksbank Salzburg eG im Jahr 2023?,tables/volks82teil2.csv,""[(0, 1)]"",[17]"
"122,0,0,Wie viele männliche Mitarbeitende in Teilzeit gab es im Jahr 2023?,tables/volks77teil3.csv,""[(1, 3)]"",[171]"
"123,1,0,Wie hoch war der NPS Score der Volksbank Vorarlberg im Jahr 2023?,tables/volks82teil2.csv,""[(3, 1)]"",[22]"
"121,0,0,Wieviele Arbeiter waren 2022 angestellt?,tables/volks77teil2.csv,""[(7, 4)]"",[1455]"
"124,0,0,Wie hoch ist die ANzahl der weiblichen Mitgliedern von Betriebsräten? ,tables/volks87teil2.csv,""[(2, 3)]"",[4]"
"123,2,0,Wie hoch war die Beteiligungsquote im Jahr 2023?,tables/volks82teil2.csv,""[(1, 2)]"",[68%]"
"121,1,0,Wie hoch war die Anzahl an männlichen Mitarbeitenden in Vollzeit im Jahr 2021?,tables/volks77teil2.csv,""[(6, 5)]"",[1419]"
"122,1,0,Wie viele Mitarbeitende mit befristetem Dienstvertrag gab es im Jahr 2023 in der männlichen Gruppe?,tables/volks77teil3.csv,""[(7, 3)]"",[15]"
"123,3,0, Wie hoch war die Beteiligungsquote bei der NPS-Umfrage im Jahr 2023 in Tirol?,tables/volks82teil2.csv,""[(2, 2)]"",[70%]"
"15,1,0,Wie viele Vollzeitäquivalente entfielen auf Frauen in Ebene 2 der Hierarchie?,tables/table16.csv,""[(1, 1)]"",[8.0]"
"90,3,0,""Wie hoch war der Anteil des Regional Umsatzes in Tausend Euro im Jahr 2023, in der Kategorie davon sonstige"",tables/volks90.csv,""[(4, 1)]"",[1937195]"
"93,1,0,Wie hoch ist das Bruttosaldo in Mio EUR am 31.12.2022?,tables/table11teil2.csv,""[(1, 1)]"",[34.0]"
"111,1,0,Wie hoch sind die direkten Emissionen (Scope 1) für das Jahr 2023?,tables/volks57f.csv,""[(0, 1)]"",[135.121]"
"48,1,0,Welche Gesamtzahl abhen Personen jünger als 30 Jahre?,tables/table55.csv,""[(3, 1)]"",[1]"
"10,3,0,Wie hoch sind die finanzierten THG-Emissionen Scope 1 im Sektor Papier?,tables/table11.csv,""[(3, 2)]"",[62762]"
"118,1,0,Welche Einheit hat die nicht-erneuerbare Heizwärme?,tables/volks59aTeil3.csv,""[(1, 2)]"",[kWh]"
"73,1,0,Welche Einheit hat das Neugeschäftsvolumen an ERGO Versicherungen von Kundinnen und Kunden des Volksbaken-Verbundes?,tables/volks38.csv,""[(3, 1)]"",[EUR (Produktion PrÃ¤mie)]"
"124,1,0,ungültig,tables/volks87teil2.csv,""[(1, 2)]"",[nan]"
"1,0,0,Wie viele Vertreter im Vergütungsausschuss: Aufsichtsrat gibt es in der KEPLER-FONDS Kapitalgesellschaft m.b.H.?,tables/table2.csv,""[(1, 2)]"",[1]"
"101,1,0,Wie viel Prozent an Angestellten o. Führungspositionen in der Bank sind im Jahre 2022 mänlich?,tables/hypo57a(problematic)teil4.csv,""[(1, 4)]"",""[37,5 %]"""
"44,3,0,Wie viele Vollzeitäquivalente (VZÄ) entfielen auf männliche Mitarbeiter innerhalb der restlichen Mitarbeiter?,tables/table51.csv,""[(2, 2)]"",[19.16]"
"50,2,0,Wie hoch war der Heizenergieverbrauch in kWh innerhalb der Organisation des Bank im Jahr 2021?,tables/hypo66.csv,""[(0, 6)]"",[1.382.032]"
"93,2,0,Wie hoch waren die finanzierten THG Emissionen (t CO2e)  für beide Scope 1 und 2 für den Sektor Schifffahrt?,tables/table11teil2.csv,""[(0, 4)]"",[17567]"
"15,2,0,Wie viele männliche Vollzeitäquivalente gehörten zum Kontrollorgan?,tables/table16.csv,""[(0, 2)]"",[24.0]"
"2,3,0,Welche Risikoarten gibt es?,tables/table3.csv,""[(5, 0)]"",[Sonstige Risiken / Ertrags- u. ProfitabilitÃ¤tsrisiko]"
"124,2,0,Wie viele weiblich Mitarbeiter sind insgesamt teil des Betriebsrates beim Volksbanken-Verbund?,tables/volks87teil2.csv,""[(4, 3)]"",[11]"
"67,4,0,Wie hoch war die Restmüllmenge des Konzerns im Jahr 2023 in Kilogramm,tables/hypo68a.csv,""[(4, 2)]"",[38700]"
"43,3,0,Wie viele Vollzeitäquivalente (VZÄ) entfallen auf Personen im Alter von über 30 und unter 50 Jahren?,tables/table47.csv,""[(4, 1)]"",[550.19]"
"63,0,0,Wie hoch war die Intensität der sonstige indirekte Emissionen in Tonnen nach dem Parameter Mitarbeiter im Konzern im Jahr 2022?,tables/hypo65c.csv,""[(2, 3)]"",[1.61]"
"76,1,0,Wie hoch war der gesamte Wärmeverbrauch aus nicht-erneuerbarer Energie im Volksbanken-Verbund im Jahr 2023 in kWh?,tables/volks59a.csv,""[(6, 3)]"",[12627682]"
"22,2,0,Wie viele weibliche Vollzeitäquivalente (VZÄ) sind im Vorstand tätig?,tables/table23.csv,""[(0, 1)]"",[1.0]"
"33,2,0,""Wie viele Vollzeitäquivalente (VZÄ) entfallen auf Personen, die älter als 50 Jahre sind?"",tables/table34.csv,""[(5, 1)]"",[48.4]"
"16,1,0,Wie hoch ist die Anzahl männlicher Vollzeitäquivalente in Deutschland?,tables/table17.csv,""[(1, 2)]"",[177.87]"
"11,0,0,Wie hoch ist das eingesetzte Material (in Tonnen) im Bereich Touristik?,tables/table12.csv,""[(0, 5)]"",[3.65]"
"120,1,0,""Wie viele THG-Emissionen in Tonnen CO2e fallen im Jahr 2023 für den Industriezweig Erziehung und Unterricht"""" an?"""""",tables/volks61teil3.csv,""[(0, 2)]"",[201]"
"60,3,0,Wie viele durchschnittliche Ausbildungstage pro Mitarbeitenden gab es im Jahr 2023 im Konzern?,tables/hypo61.csv,""[(5, 1)]"",[4.3]"
"57,1,0,Wie hoch war der Anteil an 50+ Jährigen Personen im Vorstand im Jahr 2023?,tables/hypo57a(problematic).csv,""[(4, 2)]"",""[66,7 %]"""
"22,3,0,Wie viele Vollzeitäquivalente (VZÄ) im Unternehmen waren weibliche Mitarbeitende?,tables/table23.csv,""[(3, 1)]"",[772.45]"
"119,0,0,Wie stark sind die Scope 1 + 2 Emissionen in der Kategorie im Jahr gestiegen?,tables/volks61teil2.csv,""[(8, 2)]"",[11806]"
"100,1,0,""Wie hoch war der Anteil in perzent der Angestellten mit Führungsposition, die älter als 50 Jahre waren, im Konzern 2022?"",tables/hypo57a(problematic)teil3.csv,""[(4, 3)]"",""[54,5 %]"""
"31,1,0, Wie viele Vollzeitäquivalente gibt es in der Alterskategorie über 50 Jahre?,tables/table32.csv,""[(2, 1)]"",[804.43]"
"4,1,0,Wie hoch war der Energieverbrauch innerhalb der Organisation im Bereich Nahrungsmittel in Megawattstunde ?,tables/table5.csv,""[(0, 4)]"",[388932]"
"25,2,0,Wie viele Vollzeitäquivalente gibt es in der Alterskategorie unter 30 Jahren?,tables/table26.csv,""[(3, 1)]"",[104.02]"
"71,1,0,Wie hoch war der CO2-Fußabdruck der Union Investment Immobilienfonds im Jahr 2023 in Anzahl,tables/volks33.csv,""[(3, 2)]"",[1040404913.59]"
"40,2,0,Wie viele Vollzeitäquivalente (VZÄ) entfallen in der Hierarchieebene 3 auf männliche Beschäftigte?,tables/table44.csv,""[(1, 2)]"",[54.0]"
"8,2,0,""Wie hoch sind die Emissionen (in Tonnen CO2e) aus Scope 1 und Scope 2 für den Sektor Land- und Forstwirtschaft, Fischerei?"",tables/table9.csv,""[(0, 4)]"",[212443]"
"104,1,0,Welchen Energieverbrauch (in kWh) verzeichnete der Konzern im Jahr 2021?,tables/hypo66teil2.csv,""[(3, 5)]"",[5.230.182]"
"69,2,0,Welches wichtige Thema wurde im Bericht in einem gesonderten Kapitel behandelt?,tables/volks24.csv,""[(4, 0)]"",[Digitalisierung]"
"89,1,0,Wie hoch war der Anteil an Frauen im Betriebsrat der Volksbanken?,tables/volks87.csv,""[(4, 3)]"",[1]"
"115,2,0,Wie viele Scope 1 + 2 Emissionen verursachten die gesamten Volksbanken im Jahr 2022?,tables/volks57j.csv,""[(4, 2)]"",[5103372]"
"63,1,0,Welche Intensität der THG-Emissionen in Tonnen pro Mitarbeiter wurde für die Bank 2023 gemessen?,tables/hypo65c.csv,""[(3, 2)]"",[1.75]"
"0,0,0,""Welchen SDGs kann das Thema Klima und Energie"""" zugeordnet werden?"""""",tables/table1.csv,""[(0, 3)]"",""[[7, 11, 12, 13]]"""
"122,2,0,Wie viele weiblichen Mitarbeiter gibt es mit befristetem Dienstvertrag 2021,tables/volks77teil3.csv,""[(6, 5)]"",[20]"
"0,1,0,""Mit welchem strategischen Aktionsbereich besch?ftigen sich die SDGs 9, 11 und 12?"",tables/table1.csv,""[(1, 1)]"",[Umwelt und Zukunft]"
"46,2,0, Wie viele Vollzeitäquivalente fallen in die Alterskategorie zwischen 30 und 50 Jahre Alt?,tables/table53.csv,""[(1, 1)]"",[58.03]"
"52,3,0,Wie hoch war der Zinsüberschuss der Bank im Jahr 2023 nach UGB?,tables/hypo26.csv,""[(1, 2)]"",[220.219]"
"32,3,0,Wie viele Vollzeitäquivalente entfallen auf die Altersgruppe unter 30 Jahren?,tables/table33.csv,""[(3, 1)]"",[153.48]"
"61,1,0,""Wie hoch waren die gesamten THG-Emissionen in Tonnen CO2-Äquivalent für Scopes 1, 2 und 3 im Konzern im Jahr 2022?"",tables/hypo65a.csv,""[(0, 3)]"",[1.863]"
"69,3,0,Welche wesentlichen Themen decken die GRI-Aspekte 201 und 203 ab?,tables/volks24.csv,""[(0, 0)]"",[RegionalitÃ¤t]"
"35,4,0,""Wie hoch ist die Anzahl der teilzeitbeschäftigten Angestellten, die weiblich sind?"",tables/table36.csv,""[(4, 1)]"",[80.24]"
"45,1,0,Wie viele weibliche Vollzeitäquivalente gibt es in Österreich?,tables/table52.csv,""[(0, 1)]"",[72.34]"
"89,2,0,Welche österreichische Bank hatte 2022 mehr weibliche Betriebsrätinnen als Männer?,tables/volks87.csv,""[(1, 0)]"",[Ã\x96sterreichische Ã\x84rzte- und Apothekerbank AG]"
"58,1,0,Wie hoch war der Anteil der Frauen an der Gesamtbelegschaft des Konzerns im Jahr 2023?,tables/hypo57b.csv,""[(0, 1)]"",""[56,90 %]"""
"5,1,0,Mit welcher Einheit wird die Energieintensität in den Sektoren gemessen?,tables/table6.csv,""[(2, 0)]"",[Energie kWh je kg eingesetztem Material]"
"13,0,0,Wie war der Durchschnitt der VZA in allen Bereichen?,tables/table14.csv,""[(1, 6)]"",[2935.06]"
"66,2,0,Wie oft kommt der Betriebsrat zu Zusammenkünften mit der Mitarbeitergruppe?,tables/hypo23b.csv,""[(5, 2)]"",[regelmÃ¤Ã\x9fig]"
"8,3,0,Wie hoch waren die Emissionen in Tonnen CO2e durch den Sektor Bergbau und Gewinnung von Steinen und Erden für Scope 1 im Jahr 2022?,tables/table9.csv,""[(1, 2)]"",[45455]"
"102,3,0,Auf wie viele THG-Emissionen Äquivalente änderte sich der Wert von 2021 auf 2023?,tables/hypo65bTeil2.csv,""[(5, 2)]"",[149]"
"51,2,0,In welcher Kategorie der Reisen wurden am wenigsten Pkm mit öffentlichen Verkehrsmitteln zurückgelegt?,tables/hypo67.csv,""[(3, 0)]"",[Dienstreisen]"
"19,3,0,Wie viele VZÄ entallen auf die 30 bis 50 Jährigen?,tables/table20.csv,""[(4, 1)]"",[785.61]"
"94,4,0,""Wie oft kamen Kundenmitglieder des Anlegermagaßin Am Puls, Magazin VORHABEN zusammen?"",tables/hypo23bteil2.csv,""[(5, 2)]"",[regelmÃ¤Ã\x9fig]"
"55,2,0,""Wie hoch waren die Ausgaben im Dienstleistungsbereich Soziales"""" im Jahr 2021 gemessen in tausenden von Euros (TEUR)?"""""",tables/hypo30.csv,""[(0, 3)]"",[157]"
"80,3,0,Wie hoch sind die Ausgaben (in Gramm CO2-equivalents per Euro) für Treibhausgas-Emissionen für den Industriezweig B (Bergbau und Gewinnung von Steinen und Erden) im Jahr 2023?,tables/volks61.csv,""[(2, 3)]"",[338.7]"
"95,2,0,Wie oft kommen die Mitglieder der umfassenden Presse und Oeffentlichkeitsarbeit zusammen?,tables/hypo23bteil3.csv,""[(0, 2)]"",[regelmÃ¤Ã\x9fig]"
"9,2,0,Wie viele Tonnen CO2-aequivalent wurden bei Scope 1 im Sektor Gebaeude finanziert?,tables/table10.csv,""[(0, 2)]"",[436241]"
"52,4,0,Wie viel tausend Euro wurden im Jahr 2022 von der Bank (UGB) an wirtschaftlichen Wert ausgeschuettet?,tables/hypo26.csv,""[(6, 4)]"",[-81.51]"
"119,1,0,Wie viele Tonnen CO2-aequivalent wurden im jahre 2023 vom industriezweig H - Verkehr und Lagerei ausgestossen?,tables/volks61teil2.csv,""[(2, 0)]"",[H  Verkehr und Lagerei]"
